{
  "name": "MLX Vision Server",
  "uniqueId": "mlx_vlm_server",
  "description": "MLX Machine learning multimodal research on your laptop or in a data center - by Blaizzy",
  "plugin-format": "python",
  "type": "loader",
  "version": "0.1.20",
  "model_architectures": ["LlavaForConditionalGeneration"],
  "supported_hardware_architectures": [
    "mlx"
  ],
  "files": ["main.py", "setup.sh"],
  "setup-script": "setup.sh",
  "parameters": {}
}
