{
  "name": "MLX Server - AirLLM",
  "uniqueId": "airllm_mlx_server",
  "description": "Performing inference using AirLLM on your Apple Silicon machine",
  "plugin-format": "python",
  "type": "loader",
  "version": "0.1.3",
  "model_architectures": [
    "MLX",
    "CohereForCausalLM",
    "DeepseekV2ForCausalLM",
    "GemmaForCausalLM",
    "Gemma2ForCausalLM",
    "Gemma3ForCausalLM",
    "GPTBigCodeForCausalLM",
    "LlamaForCausalLM",
    "MistralForCausalLM",
    "MixtralForCausalLM",
    "PhiForCausalLM",
    "Phi3ForCausalLM",
    "Qwen2ForCausalLM"
  ],
  "supported_hardware_architectures": ["mlx"],
  "files": ["main.py", "setup.sh"],
  "setup-script": "setup.sh",
  "parameters": {}
}
